{
  "schema_version": 1,
  "plan_id": "22222222-2222-4222-8222-222222222222",
  "owner_id": "33333333-3333-4333-8333-333333333333",
  "created_at": "2026-09-10T00:00:00Z",
  "expires_at": "2026-09-10T00:30:00Z",
  "recovery_generation": "44444444-4444-4444-8444-444444444444",
  "action_id": "software.check",
  "action_version": "1.0.0",
  "bundle_id": "bundle-ops-1",
  "policy_digest": "cccccccccccccccccccccccccccccccccccccccccccccccccccccccccccccccc",
  "resolved_targets": ["lab-global-primary"],
  "excluded": [],
  "target_bindings": {
    "lab-global-primary": {
      "connection_digest": "dddddddddddddddddddddddddddddddddddddddddddddddddddddddddddddddd",
      "platform": {"os": "linux", "family": "debian", "arch": "amd64"},
      "policy_digest": "cccccccccccccccccccccccccccccccccccccccccccccccccccccccccccccccc"
    }
  },
  "resolved_params": {"software_id": "ops-core"},
  "package_digest": null,
  "impact": {"summary": "read-only software inspection", "service_interruption": false, "data_risk": false, "restart_required": false},
  "recovery_evidence_refs": [],
  "verification": ["fact-written"],
  "elevated": false,
  "max_runtime_seconds": 120,
  "plan_digest": "1082f07421b9d3b91919a04a0c28e398f391d2956229d93c4b2dc8f7d4c37d77"
}
